Row#,Page/Endpoint Name,Route/URL Pattern,Type,Priority,Auditor Tool,Perf Check,SEO Check,A11y Check,Security Check,Content Check,Functional Check,Audit Status,Notes
1,About,/about,Static,HIGH,Gemini CLI + User,LCP < 2.5s; images WebP; no unused JS,Title unique; meta desc; H1; OG; Schema:AboutPage; internal links present,H1>H2>H3 hierarchy; img alts; font ≥16px; contrast OK,External links noopener; no form risk,Team info accurate; mission aligned with brand; NEXQON reference correct; no outdated info,All internal links work; social links open correctly; CTA buttons navigate,Not Started,Verify NEXQON / cloudbasket relationship is stated correctly
2,Careers,/careers,Static,MEDIUM,Gemini CLI + User,LCP < 2.5s; minimal JS; fast TTFB,Title unique; meta desc; H1; noindex if no open roles; Schema:JobPosting if roles listed,Heading structure; apply CTA ARIA labeled; job listing markup accessible,CSRF if apply form present; file upload validation if resume upload exists,Job listings current; no expired roles; contact info correct; role descriptions complete,Apply link works; contact form sends; email link opens mail client,Not Started,⚠️ Add noindex meta if page has no active job listings
3,Pricing,/pricing,Static,HIGH,ALL,LCP < 2s; pricing table no CLS; toggle no layout shift,Title unique; meta desc; H1; Schema:Offer or PriceSpecification; OG tags,Pricing table screen-reader readable; toggle labeled; keyboard nav; plan cards accessible,Price data not client-manipulable; checkout links HTTPS only; no hardcoded credentials,Prices accurate in INR; feature matrix correct; CTA labels clear (Free/Pro/Enterprise); FAQs present,Plan toggle switches; CTA leads to correct signup; Contact Sales link works,Not Started,Verify prices match actual product tier offerings — critical before launch
4,Partners,/partners,Static,MEDIUM,Gemini CLI + User,Fast load; partner logos WebP; lazy-load logos,Title; meta desc; H1; Schema:Organization; partner link tracking,Logo img alts; heading structure; keyboard nav OK,External partner links noopener; no sensitive partner data exposed,Partner logos current; descriptions accurate; apply CTA clear; no stale partnerships listed,Partner logos load; apply/contact link works; external partner links open correctly,Not Started,Verify all listed partners are active — remove stale entries
5,App Landing,/app,Static,MEDIUM,Lighthouse + User,LCP < 2s; app store images optimized; no excess JS,Title; meta desc; H1; Schema:SoftwareApplication; OG with app preview image,App preview img alts; download CTA ARIA labeled; mobile layout accessible,External app store links noopener; no app credentials exposed,App description accurate; download links valid; platform icons correct (iOS/Android),App store links open correctly; QR code functional if present; feedback link works,Not Started,Confirm app store links point to live published listings — not placeholders
